[
  {
    "id": "connector_config",
    "title": "Configuration Resend",
    "scope": "context",
    "contextField": "context_id",
    "fields": [
      {
        "id": "context_id",
        "type": "string",
        "nullable": false,
        "protected": true,
        "computed": false,
        "constraints": {
          "minLength": 1,
          "maxLength": 128
        }
      },
      {
        "id": "id",
        "type": "string",
        "nullable": false,
        "protected": false,
        "computed": false,
        "constraints": {
          "minLength": 1,
          "maxLength": 128
        }
      },
      {
        "id": "origin",
        "type": "string",
        "nullable": false,
        "protected": false,
        "computed": false,
        "constraints": {
          "minLength": 8,
          "maxLength": 512
        }
      },
      {
        "id": "from_address",
        "type": "string",
        "nullable": false,
        "protected": false,
        "computed": false,
        "constraints": {
          "minLength": 3,
          "maxLength": 320
        }
      },
      {
        "id": "key_ref",
        "type": "string",
        "nullable": true,
        "protected": false,
        "computed": false,
        "constraints": {
          "minLength": 1,
          "maxLength": 128
        }
      },
      {
        "id": "secret_version",
        "type": "integer",
        "nullable": true,
        "protected": false,
        "computed": false,
        "constraints": {
          "minimum": 1
        }
      },
      {
        "id": "enabled",
        "type": "boolean",
        "nullable": false,
        "protected": false,
        "computed": false
      },
      {
        "id": "revision",
        "type": "integer",
        "nullable": false,
        "protected": false,
        "computed": false,
        "constraints": {
          "minimum": 1
        }
      },
      {
        "id": "updated_at",
        "type": "date-time",
        "nullable": false,
        "protected": false,
        "computed": false
      }
    ],
    "primaryKey": [
      "context_id",
      "id"
    ],
    "indexes": [],
    "relations": [],
    "permissions": [
      {
        "moduleId": "creezio.resend",
        "kind": "permission",
        "id": "manage"
      },
      {
        "moduleId": "creezio.resend",
        "kind": "permission",
        "id": "use"
      }
    ],
    "deletion": {
      "mode": "soft",
      "requiresApproval": false
    },
    "public": false
  },
  {
    "id": "connector_secret",
    "title": "Secret Resend scellé",
    "scope": "context",
    "contextField": "context_id",
    "fields": [
      {
        "id": "context_id",
        "type": "string",
        "nullable": false,
        "protected": true,
        "computed": false,
        "constraints": {
          "minLength": 1,
          "maxLength": 128
        }
      },
      {
        "id": "id",
        "type": "string",
        "nullable": false,
        "protected": true,
        "computed": false,
        "constraints": {
          "minLength": 1,
          "maxLength": 128
        }
      },
      {
        "id": "binding_id",
        "type": "string",
        "nullable": false,
        "protected": true,
        "computed": false,
        "constraints": {
          "minLength": 1,
          "maxLength": 128
        }
      },
      {
        "id": "ciphertext",
        "type": "string",
        "nullable": false,
        "protected": true,
        "computed": false,
        "constraints": {
          "minLength": 1,
          "maxLength": 32768
        }
      },
      {
        "id": "key_id",
        "type": "string",
        "nullable": false,
        "protected": true,
        "computed": false,
        "constraints": {
          "minLength": 1,
          "maxLength": 128
        }
      },
      {
        "id": "version",
        "type": "integer",
        "nullable": false,
        "protected": true,
        "computed": false,
        "constraints": {
          "minimum": 1
        }
      },
      {
        "id": "state",
        "type": "string",
        "nullable": false,
        "protected": true,
        "computed": false,
        "constraints": {
          "enum": [
            "active",
            "revoked"
          ]
        }
      }
    ],
    "primaryKey": [
      "context_id",
      "id"
    ],
    "indexes": [],
    "relations": [],
    "permissions": [
      {
        "moduleId": "creezio.resend",
        "kind": "permission",
        "id": "manage"
      },
      {
        "moduleId": "creezio.resend",
        "kind": "permission",
        "id": "use"
      }
    ],
    "deletion": {
      "mode": "soft",
      "requiresApproval": false
    },
    "public": false
  }
]
